{
  "cases": [
    {
      "analysis_note": "",
      "analysis_status": "pass",
      "case_id": "vmat_truebeam_canonical",
      "domain": "VMAT_IMRT",
      "expected_formula_version": "geometry-v4",
      "expected_supported": true,
      "formula_version_note": "",
      "formula_version_status": "pass",
      "observed_formula_version": "geometry-v4",
      "reference_exact_green": true,
      "required_formula_version": "geometry-v4",
      "supported": true
    },
    {
      "analysis_note": "",
      "analysis_status": "pass",
      "case_id": "vmat_halcyon_edge",
      "domain": "VMAT_IMRT",
      "expected_formula_version": "geometry-v4",
      "expected_supported": true,
      "formula_version_note": "",
      "formula_version_status": "pass",
      "observed_formula_version": "geometry-v4",
      "reference_exact_green": true,
      "required_formula_version": "geometry-v4",
      "supported": true
    },
    {
      "analysis_note": "",
      "analysis_status": "pass",
      "case_id": "tomo_canonical",
      "domain": "TOMO",
      "expected_formula_version": "tomo-v3",
      "expected_supported": true,
      "formula_version_note": "",
      "formula_version_status": "pass",
      "observed_formula_version": "tomo-v3",
      "reference_exact_green": true,
      "required_formula_version": "tomo-v3",
      "supported": true
    },
    {
      "analysis_note": "",
      "analysis_status": "pass",
      "case_id": "tomo_default_inference_edge",
      "domain": "TOMO",
      "expected_formula_version": "tomo-v3",
      "expected_supported": true,
      "formula_version_note": "",
      "formula_version_status": "pass",
      "observed_formula_version": "tomo-v3",
      "reference_exact_green": true,
      "required_formula_version": "tomo-v3",
      "supported": true
    },
    {
      "analysis_note": "",
      "analysis_status": "pass",
      "case_id": "cyberknife_multiplan_canonical",
      "domain": "CYBERKNIFE_MLC",
      "expected_formula_version": "geometry-v4",
      "expected_supported": true,
      "formula_version_note": "",
      "formula_version_status": "pass",
      "observed_formula_version": "geometry-v4",
      "reference_exact_green": true,
      "required_formula_version": "geometry-v4",
      "supported": true
    },
    {
      "analysis_note": "",
      "analysis_status": "pass",
      "case_id": "cyberknife_precision_missing_xml_edge",
      "domain": "CYBERKNIFE_MLC",
      "expected_formula_version": "geometry-v4",
      "expected_supported": false,
      "formula_version_note": "",
      "formula_version_status": "pass",
      "observed_formula_version": "geometry-v4",
      "reference_exact_green": true,
      "required_formula_version": "geometry-v4",
      "supported": false
    },
    {
      "analysis_note": "",
      "analysis_status": "pass",
      "case_id": "aurora_canonical",
      "domain": "AURORA",
      "expected_formula_version": null,
      "expected_supported": true,
      "formula_version_note": "Legacy baseline has no formula-version provenance.",
      "formula_version_status": "legacy-unversioned",
      "observed_formula_version": null,
      "reference_exact_green": true,
      "required_formula_version": null,
      "supported": true
    },
    {
      "analysis_note": "",
      "analysis_status": "pass",
      "case_id": "aurora_research_edge",
      "domain": "AURORA",
      "expected_formula_version": null,
      "expected_supported": true,
      "formula_version_note": "Legacy baseline has no formula-version provenance.",
      "formula_version_status": "legacy-unversioned",
      "observed_formula_version": null,
      "reference_exact_green": true,
      "required_formula_version": null,
      "supported": true
    }
  ],
  "generated_at": "2026-09-19T14:33:23Z",
  "profile_key": "research",
  "report_id": "validation-research-20260919T143323UTC",
  "results": [
    {
      "case_id": "vmat_truebeam_canonical",
      "comparison_class": "exact-equivalent",
      "metric_key": "aav",
      "platform": "VMAT_IMRT",
      "status": "pass"
    },
    {
      "case_id": "vmat_truebeam_canonical",
      "comparison_class": "derived-equivalent",
      "metric_key": "acc_0_40",
      "platform": "VMAT_IMRT",
      "status": "skipped"
    },
    {
      "case_id": "vmat_truebeam_canonical",
      "comparison_class": "derived-equivalent",
      "metric_key": "acc_120_160",
      "platform": "VMAT_IMRT",
      "status": "skipped"
    },
    {
      "case_id": "vmat_truebeam_canonical",
      "comparison_class": "derived-equivalent",
      "metric_key": "acc_160_200",
      "platform": "VMAT_IMRT",
      "status": "skipped"
    },
    {
      "case_id": "vmat_truebeam_canonical",
      "comparison_class": "derived-equivalent",
      "metric_key": "acc_40_80",
      "platform": "VMAT_IMRT",
      "status": "skipped"
    },
    {
      "case_id": "vmat_truebeam_canonical",
      "comparison_class": "derived-equivalent",
      "metric_key": "acc_80_120",
      "platform": "VMAT_IMRT",
      "status": "skipped"
    },
    {
      "case_id": "vmat_truebeam_canonical",
      "comparison_class": "derived-equivalent",
      "metric_key": "acc_average",
      "platform": "VMAT_IMRT",
      "status": "skipped"
    },
    {
      "case_id": "vmat_truebeam_canonical",
      "comparison_class": "derived-equivalent",
      "metric_key": "acc_std",
      "platform": "VMAT_IMRT",
      "status": "skipped"
    },
    {
      "case_id": "vmat_truebeam_canonical",
      "comparison_class": "exact-equivalent",
      "metric_key": "al",
      "platform": "VMAT_IMRT",
      "status": "pass"
    },
    {
      "case_id": "vmat_truebeam_canonical",
      "comparison_class": "exact-equivalent",
      "metric_key": "alg",
      "platform": "VMAT_IMRT",
      "status": "pass"
    },
    {
      "case_id": "vmat_truebeam_canonical",
      "comparison_class": "exact-equivalent",
      "metric_key": "alg_sd",
      "platform": "VMAT_IMRT",
      "status": "pass"
    },
    {
      "case_id": "vmat_truebeam_canonical",
      "comparison_class": "exact-equivalent",
      "metric_key": "asr",
      "platform": "VMAT_IMRT",
      "status": "pass"
    },
    {
      "case_id": "vmat_truebeam_canonical",
      "comparison_class": "exact-equivalent",
      "metric_key": "axjd",
      "platform": "VMAT_IMRT",
      "status": "pass"
    },
    {
      "case_id": "vmat_truebeam_canonical",
      "comparison_class": "exact-equivalent",
      "metric_key": "ayjd",
      "platform": "VMAT_IMRT",
      "status": "pass"
    },
    {
      "case_id": "vmat_truebeam_canonical",
      "comparison_class": "exact-equivalent",
      "metric_key": "bjar",
      "platform": "VMAT_IMRT",
      "status": "pass"
    },
    {
      "case_id": "vmat_truebeam_canonical",
      "comparison_class": "exact-equivalent",
      "metric_key": "cal",
      "platform": "VMAT_IMRT",
      "status": "pass"
    },
    {
      "case_id": "vmat_truebeam_canonical",
      "comparison_class": "exact-equivalent",
      "metric_key": "cam",
      "platform": "VMAT_IMRT",
      "status": "pass"
    },
    {
      "case_id": "vmat_truebeam_canonical",
      "comparison_class": "exact-equivalent",
      "metric_key": "dr",
      "platform": "VMAT_IMRT",
      "status": "pass"
    },
    {
      "case_id": "vmat_truebeam_canonical",
      "comparison_class": "exact-equivalent",
      "metric_key": "dt",
      "platform": "VMAT_IMRT",
      "status": "pass"
    },
    {
      "case_id": "vmat_truebeam_canonical",
      "comparison_class": "exact-equivalent",
      "metric_key": "eam",
      "platform": "VMAT_IMRT",
      "status": "pass"
    },
    {
      "case_id": "vmat_truebeam_canonical",
      "comparison_class": "exact-equivalent",
      "metric_key": "efs",
      "platform": "VMAT_IMRT",
      "status": "pass"
    },
    {
      "case_id": "vmat_truebeam_canonical",
      "comparison_class": "exact-equivalent",
      "metric_key": "em",
      "platform": "VMAT_IMRT",
      "status": "pass"
    },
    {
      "case_id": "vmat_truebeam_canonical",
      "comparison_class": "exact-equivalent",
      "metric_key": "fraction_dose_gy",
      "platform": "VMAT_IMRT",
      "status": "pass"
    },
    {
      "case_id": "vmat_truebeam_canonical",
      "comparison_class": "exact-equivalent",
      "metric_key": "fractions_count",
      "platform": "VMAT_IMRT",
      "status": "pass"
    },
    {
      "case_id": "vmat_truebeam_canonical",
      "comparison_class": "exact-equivalent",
      "metric_key": "gs",
      "platform": "VMAT_IMRT",
      "status": "pass"
    },
    {
      "case_id": "vmat_truebeam_canonical",
      "comparison_class": "exact-equivalent",
      "metric_key": "gt",
      "platform": "VMAT_IMRT",
      "status": "pass"
    },
    {
      "case_id": "vmat_truebeam_canonical",
      "comparison_class": "exact-equivalent",
      "metric_key": "ja",
      "platform": "VMAT_IMRT",
      "status": "pass"
    },
    {
      "case_id": "vmat_truebeam_canonical",
      "comparison_class": "exact-equivalent",
      "metric_key": "lna",
      "platform": "VMAT_IMRT",
      "status": "pass"
    },
    {
      "case_id": "vmat_truebeam_canonical",
      "comparison_class": "exact-equivalent",
      "metric_key": "ls",
      "platform": "VMAT_IMRT",
      "status": "pass"
    },
    {
      "case_id": "vmat_truebeam_canonical",
      "comparison_class": "exact-equivalent",
      "metric_key": "lsv",
      "platform": "VMAT_IMRT",
      "status": "pass"
    },
    {
      "case_id": "vmat_truebeam_canonical",
      "comparison_class": "exact-equivalent",
      "metric_key": "lt",